{
  "paper_id": "SYN-004",
  "citation": "Synthetic demonstration record 4 (not a real publication)",
  "title": "Synthetic interrupted time-series evaluation of media reporting guidelines",
  "abstract": "Synthetic record for true-conflict testing.",
  "study_type": "interrupted time series",
  "population": ["general population"],
  "setting": ["regional media environment"],
  "intervention_or_exposure": ["media reporting guideline"],
  "comparator": ["pre-guideline period"],
  "outcomes": ["population suicide rate"],
  "effect_estimates": [],
  "uncertainty": ["Synthetic record"],
  "methods": ["interrupted time series"],
  "evidence_claims": [{
    "claim_id": "SYN-004-C1",
    "statement": "This synthetic time-series analysis reported a decrease in the population suicide rate after guideline introduction.",
    "direction": "beneficial",
    "population": "general population",
    "intervention_or_exposure": "media reporting guideline",
    "outcome": "population suicide rate",
    "method": "interrupted time series",
    "causal_language_allowed": false,
    "provenance": [{"source_type":"figure","locator":"Synthetic Figure 1"}]
  }],
  "limitations": ["Synthetic record; ecological design; not scientific evidence"],
  "applicability": ["Population-level only"],
  "safety_boundaries": ["Do not infer individual risk"],
  "resources": [],
  "executable_tools": [],
  "provenance": [{"source_type":"metadata","locator":"synthetic fixture"}],
  "related_papers": ["SYN-005"],
  "metadata": {"record_status":"synthetic"}
}