{
  "paper_id": "SYN-002",
  "citation": "Synthetic demonstration record 2 (not a real publication)",
  "title": "Synthetic observational evaluation of school-based psychoeducation in adolescents",
  "abstract": "Synthetic record created only to test methodological heterogeneity.",
  "study_type": "prospective observational study",
  "population": ["adolescents"],
  "setting": ["secondary schools"],
  "intervention_or_exposure": ["school-based psychoeducation"],
  "comparator": ["non-participating schools"],
  "outcomes": ["suicidal ideation"],
  "effect_estimates": [{"outcome":"suicidal ideation","measure":"adjusted mean difference","estimate":0.01,"lower_ci":-0.12,"upper_ci":0.14}],
  "uncertainty": ["Synthetic confidence interval crosses the null"],
  "methods": ["prospective observational study"],
  "evidence_claims": [{
    "claim_id": "SYN-002-C1",
    "statement": "In this synthetic observational adolescent sample, no clear difference in suicidal-ideation scores was detected between participating and non-participating schools.",
    "direction": "null",
    "population": "adolescents",
    "intervention_or_exposure": "school-based psychoeducation",
    "outcome": "suicidal ideation",
    "method": "prospective observational study",
    "causal_language_allowed": false,
    "provenance": [{"source_type":"table","locator":"Synthetic Table 3"}]
  }],
  "limitations": ["Synthetic record; observational design; not scientific evidence"],
  "applicability": ["Demonstration population is adolescents only"],
  "safety_boundaries": ["Do not infer treatment efficacy or individual risk"],
  "resources": [],
  "executable_tools": [],
  "provenance": [{"source_type":"metadata","locator":"synthetic fixture"}],
  "related_papers": ["SYN-001"],
  "metadata": {"record_status":"synthetic"}
}