{
  "paper_id": "SYN-003",
  "citation": "Synthetic demonstration record 3 (not a real publication)",
  "title": "Synthetic trial of a school-based programme in young adults",
  "abstract": "Synthetic record for population-transfer testing.",
  "study_type": "randomized controlled trial",
  "population": ["young adults"],
  "setting": ["colleges"],
  "intervention_or_exposure": ["school-based psychoeducation"],
  "comparator": ["usual curriculum"],
  "outcomes": ["suicidal ideation"],
  "effect_estimates": [],
  "uncertainty": ["Synthetic record"],
  "methods": ["randomized controlled trial"],
  "evidence_claims": [{
    "claim_id": "SYN-003-C1",
    "statement": "This synthetic young-adult trial reported lower suicidal-ideation scores after the programme.",
    "direction": "beneficial",
    "population": "young adults",
    "intervention_or_exposure": "school-based psychoeducation",
    "outcome": "suicidal ideation",
    "method": "randomized controlled trial",
    "causal_language_allowed": true,
    "provenance": [{"source_type":"figure","locator":"Synthetic Figure 2"}]
  }],
  "limitations": ["Synthetic record; not scientific evidence"],
  "applicability": ["Does not directly study older adults"],
  "safety_boundaries": ["Do not generalize to unstudied populations without qualification"],
  "resources": [],
  "executable_tools": [],
  "provenance": [{"source_type":"metadata","locator":"synthetic fixture"}],
  "related_papers": ["SYN-001", "SYN-002"],
  "metadata": {"record_status":"synthetic"}
}