{
  "paper_id": "SYN-001",
  "citation": "Synthetic demonstration record 1 (not a real publication)",
  "title": "Synthetic randomized trial of school-based psychoeducation in adolescents",
  "abstract": "Synthetic record created only to test the paper-as-skill architecture.",
  "study_type": "randomized controlled trial",
  "population": ["adolescents"],
  "setting": ["secondary schools"],
  "intervention_or_exposure": ["school-based psychoeducation"],
  "comparator": ["usual curriculum"],
  "outcomes": ["suicidal ideation"],
  "effect_estimates": [{"outcome":"suicidal ideation","measure":"standardized mean difference","estimate":-0.25,"lower_ci":-0.40,"upper_ci":-0.10}],
  "uncertainty": ["Synthetic confidence interval for demonstration only"],
  "methods": ["randomized controlled trial"],
  "evidence_claims": [{
    "claim_id": "SYN-001-C1",
    "statement": "In this synthetic randomized adolescent sample, the school-based programme was associated with lower suicidal-ideation scores than the comparator.",
    "direction": "beneficial",
    "population": "adolescents",
    "intervention_or_exposure": "school-based psychoeducation",
    "outcome": "suicidal ideation",
    "method": "randomized controlled trial",
    "causal_language_allowed": true,
    "provenance": [{"source_type":"table","locator":"Synthetic Table 2"}]
  }],
  "limitations": ["Synthetic record; not scientific evidence"],
  "applicability": ["Demonstration population is adolescents only"],
  "safety_boundaries": ["Do not use to infer individual suicide risk"],
  "resources": [],
  "executable_tools": [],
  "provenance": [{"source_type":"metadata","locator":"synthetic fixture"}],
  "related_papers": ["SYN-002"],
  "metadata": {"record_status":"synthetic"}
}